2019-05-03 21:07:37.300845 IP 172.16.47.168.ssh > 172.16.47.1.63101: Flags [P.], seq 3541416888:3541417012, ack 934359672, win 389, options [nop,nop,TS val 885074 ecr 238826345], length 124
2019-05-03 21:07:37.300855 IP 172.16.47.168.ssh > 172.16.47.1.63101: Flags [P.], seq 0:124, ack 1, win 389, options [nop,nop,TS val 885074 ecr 238826345], length 124
2019-05-03 21:07:37.301069 IP 172.16.47.1.63101 > 172.16.47.168.ssh: Flags [.], ack 124, win 2046, options [nop,nop,TS val 238827279 ecr 885074], length 0
2019-05-03 21:07:37.301075 IP 172.16.47.1.63101 > 172.16.47.168.ssh: Flags [.], ack 124, win 2046, options [nop,nop,TS val 238827279 ecr 885074], length 0
2019-05-03 21:07:38.949588 IP 172.16.47.1.63210 > 172.16.47.168.ssh: Flags [P.], seq 3671073296:3671073332, ack 1159638271, win 2048, options [nop,nop,TS val 238828919 ecr 883860], length 36
2019-05-03 21:07:38.949599 IP 172.16.47.1.63210 > 172.16.47.168.ssh: Flags [P.], seq 0:36, ack 1, win 2048, options [nop,nop,TS val 238828919 ecr 883860], length 36
2019-05-03 21:07:38.950088 IP 172.16.47.168.ssh > 172.16.47.1.63210: Flags [P.], seq 1:37, ack 36, win 1452, options [nop,nop,TS val 885486 ecr 238828919], length 36
2019-05-03 21:07:38.950094 IP 172.16.47.168.ssh > 172.16.47.1.63210: Flags [P.], seq 1:37, ack 36, win 1452, options [nop,nop,TS val 885486 ecr 238828919], length 36
2019-05-03 21:07:38.950306 IP 172.16.47.1.63210 > 172.16.47.168.ssh: Flags [.], ack 37, win 2047, options [nop,nop,TS val 238828919 ecr 885486], length 0
2019-05-03 21:07:38.950312 IP 172.16.47.1.63210 > 172.16.47.168.ssh: Flags [.], ack 37, win 2047, options [nop,nop,TS val 238828919 ecr 885486], length 0
2019-05-03 21:07:39.027196 IP 172.16.47.168.ssh > 172.16.47.1.63210: Flags [P.], seq 37:73, ack 36, win 1452, options [nop,nop,TS val 885505 ecr 238828919], length 36
2019-05-03 21:07:39.027205 IP 172.16.47.168.ssh > 172.16.47.1.63210: Flags [P.], seq 37:73, ack 36, win 1452, options [nop,nop,TS val 885505 ecr 238828919], length 36
2019-05-03 21:07:39.027408 IP 172.16.47.1.63210 > 172.16.47.168.ssh: Flags [.], ack 73, win 2047, options [nop,nop,TS val 238828996 ecr 885505], length 0
2019-05-03 21:07:39.027415 IP 172.16.47.1.63210 > 172.16.47.168.ssh: Flags [.], ack 73, win 2047, options [nop,nop,TS val 238828996 ecr 885505], length 0
2019-05-03 21:07:39.027426 IP 172.16.47.168.ssh > 172.16.47.1.63210: Flags [P.], seq 73:145, ack 36, win 1452, options [nop,nop,TS val 885505 ecr 238828919], length 72
2019-05-03 21:07:39.027430 IP 172.16.47.168.ssh > 172.16.47.1.63210: Flags [P.], seq 73:145, ack 36, win 1452, options [nop,nop,TS val 885505 ecr 238828919], length 72
2019-05-03 21:07:39.027567 IP 172.16.47.1.63210 > 172.16.47.168.ssh: Flags [.], ack 145, win 2046, options [nop,nop,TS val 238828996 ecr 885505], length 0
2019-05-03 21:07:39.027571 IP 172.16.47.1.63210 > 172.16.47.168.ssh: Flags [.], ack 145, win 2046, options [nop,nop,TS val 238828996 ecr 885505], length 0
2019-05-03 21:07:39.027572 IP 172.16.47.168.ssh > 172.16.47.1.63210: Flags [P.], seq 145:181, ack 36, win 1452, options [nop,nop,TS val 885505 ecr 238828996], length 36
2019-05-03 21:07:39.027578 IP 172.16.47.168.ssh > 172.16.47.1.63210: Flags [P.], seq 145:181, ack 36, win 1452, options [nop,nop,TS val 885505 ecr 238828996], length 36
2019-05-03 21:07:39.027726 IP 172.16.47.1.63210 > 172.16.47.168.ssh: Flags [.], ack 181, win 2047, options [nop,nop,TS val 238828996 ecr 885505], length 0
2019-05-03 21:07:39.027731 IP 172.16.47.1.63210 > 172.16.47.168.ssh: Flags [.], ack 181, win 2047, options [nop,nop,TS val 238828996 ecr 885505], length 0
2019-05-03 21:07:39.027731 IP 172.16.47.168.ssh > 172.16.47.1.63210: Flags [P.], seq 181:217, ack 36, win 1452, options [nop,nop,TS val 885505 ecr 238828996], length 36
2019-05-03 21:07:39.027736 IP 172.16.47.168.ssh > 172.16.47.1.63210: Flags [P.], seq 181:217, ack 36, win 1452, options [nop,nop,TS val 885505 ecr 238828996], length 36
2019-05-03 21:07:39.027903 IP 172.16.47.168.ssh > 172.16.47.1.63210: Flags [P.], seq 217:253, ack 36, win 1452, options [nop,nop,TS val 885506 ecr 238828996], length 36
2019-05-03 21:07:39.027909 IP 172.16.47.168.ssh > 172.16.47.1.63210: Flags [P.], seq 217:253, ack 36, win 1452, options [nop,nop,TS val 885506 ecr 238828996], length 36
2019-05-03 21:07:39.028035 IP 172.16.47.1.63210 > 172.16.47.168.ssh: Flags [.], ack 217, win 2047, options [nop,nop,TS val 238828996 ecr 885505], length 0
2019-05-03 21:07:39.028041 IP 172.16.47.1.63210 > 172.16.47.168.ssh: Flags [.], ack 217, win 2047, options [nop,nop,TS val 238828996 ecr 885505], length 0
2019-05-03 21:07:39.028057 IP 172.16.47.1.63210 > 172.16.47.168.ssh: Flags [.], ack 253, win 2047, options [nop,nop,TS val 238828996 ecr 885506], length 0
2019-05-03 21:07:39.028061 IP 172.16.47.1.63210 > 172.16.47.168.ssh: Flags [.], ack 253, win 2047, options [nop,nop,TS val 238828996 ecr 885506], length 0
2019-05-03 21:07:39.028078 IP 172.16.47.168.ssh > 172.16.47.1.63210: Flags [P.], seq 253:289, ack 36, win 1452, options [nop,nop,TS val 885506 ecr 238828996], length 36
2019-05-03 21:07:39.028083 IP 172.16.47.168.ssh > 172.16.47.1.63210: Flags [P.], seq 253:289, ack 36, win 1452, options [nop,nop,TS val 885506 ecr 238828996], length 36
2019-05-03 21:07:39.028232 IP 172.16.47.1.63210 > 172.16.47.168.ssh: Flags [.], ack 289, win 2047, options [nop,nop,TS val 238828996 ecr 885506], length 0
2019-05-03 21:07:39.028236 IP 172.16.47.1.63210 > 172.16.47.168.ssh: Flags [.], ack 289, win 2047, options [nop,nop,TS val 238828996 ecr 885506], length 0
2019-05-03 21:07:39.028248 IP 172.16.47.168.ssh > 172.16.47.1.63210: Flags [P.], seq 289:361, ack 36, win 1452, options [nop,nop,TS val 885506 ecr 238828996], length 72
2019-05-03 21:07:39.028255 IP 172.16.47.168.ssh > 172.16.47.1.63210: Flags [P.], seq 289:361, ack 36, win 1452, options [nop,nop,TS val 885506 ecr 238828996], length 72
2019-05-03 21:07:39.028391 IP 172.16.47.168.ssh > 172.16.47.1.63210: Flags [P.], seq 361:397, ack 36, win 1452, options [nop,nop,TS val 885506 ecr 238828996], length 36
2019-05-03 21:07:39.028395 IP 172.16.47.168.ssh > 172.16.47.1.63210: Flags [P.], seq 361:397, ack 36, win 1452, options [nop,nop,TS val 885506 ecr 238828996], length 36
2019-05-03 21:07:39.028523 IP 172.16.47.1.63210 > 172.16.47.168.ssh: Flags [.], ack 361, win 2046, options [nop,nop,TS val 238828997 ecr 885506], length 0
2019-05-03 21:07:39.028528 IP 172.16.47.1.63210 > 172.16.47.168.ssh: Flags [.], ack 361, win 2046, options [nop,nop,TS val 238828997 ecr 885506], length 0
2019-05-03 21:07:39.028541 IP 172.16.47.1.63210 > 172.16.47.168.ssh: Flags [.], ack 397, win 2047, options [nop,nop,TS val 238828997 ecr 885506], length 0
2019-05-03 21:07:39.028544 IP 172.16.47.1.63210 > 172.16.47.168.ssh: Flags [.], ack 397, win 2047, options [nop,nop,TS val 238828997 ecr 885506], length 0
2019-05-03 21:07:39.028547 IP 172.16.47.168.ssh > 172.16.47.1.63210: Flags [P.], seq 397:433, ack 36, win 1452, options [nop,nop,TS val 885506 ecr 238828997], length 36
2019-05-03 21:07:39.028553 IP 172.16.47.168.ssh > 172.16.47.1.63210: Flags [P.], seq 397:433, ack 36, win 1452, options [nop,nop,TS val 885506 ecr 238828997], length 36
2019-05-03 21:07:39.028701 IP 172.16.47.168.ssh > 172.16.47.1.63210: Flags [P.], seq 433:469, ack 36, win 1452, options [nop,nop,TS val 885506 ecr 238828997], length 36
2019-05-03 21:07:39.028706 IP 172.16.47.168.ssh > 172.16.47.1.63210: Flags [P.], seq 433:469, ack 36, win 1452, options [nop,nop,TS val 885506 ecr 238828997], length 36
2019-05-03 21:07:39.028872 IP 172.16.47.1.63210 > 172.16.47.168.ssh: Flags [.], ack 433, win 2047, options [nop,nop,TS val 238828997 ecr 885506], length 0
2019-05-03 21:07:39.028880 IP 172.16.47.1.63210 > 172.16.47.168.ssh: Flags [.], ack 433, win 2047, options [nop,nop,TS val 238828997 ecr 885506], length 0
2019-05-03 21:07:39.028910 IP 172.16.47.1.63210 > 172.16.47.168.ssh: Flags [.], ack 469, win 2047, options [nop,nop,TS val 238828997 ecr 885506], length 0
2019-05-03 21:07:39.028910 IP 172.16.47.168.ssh > 172.16.47.1.63210: Flags [P.], seq 469:505, ack 36, win 1452, options [nop,nop,TS val 885506 ecr 238828997], length 36
2019-05-03 21:07:39.028915 IP 172.16.47.1.63210 > 172.16.47.168.ssh: Flags [.], ack 469, win 2047, options [nop,nop,TS val 238828997 ecr 885506], length 0
2019-05-03 21:07:39.028915 IP 172.16.47.168.ssh > 172.16.47.1.63210: Flags [P.], seq 469:505, ack 36, win 1452, options [nop,nop,TS val 885506 ecr 238828997], length 36
2019-05-03 21:07:39.029066 IP 172.16.47.1.63210 > 172.16.47.168.ssh: Flags [.], ack 505, win 2047, options [nop,nop,TS val 238828997 ecr 885506], length 0
2019-05-03 21:07:39.029089 IP 172.16.47.168.ssh > 172.16.47.1.63210: Flags [P.], seq 505:577, ack 36, win 1452, options [nop,nop,TS val 885506 ecr 238828997], length 72
2019-05-03 21:07:39.029093 IP 172.16.47.168.ssh > 172.16.47.1.63210: Flags [P.], seq 505:577, ack 36, win 1452, options [nop,nop,TS val 885506 ecr 238828997], length 72
2019-05-03 21:07:39.029097 IP 172.16.47.1.63210 > 172.16.47.168.ssh: Flags [.], ack 505, win 2047, options [nop,nop,TS val 238828997 ecr 885506], length 0
2019-05-03 21:07:39.029245 IP 172.16.47.1.63210 > 172.16.47.168.ssh: Flags [.], ack 577, win 2046, options [nop,nop,TS val 238828997 ecr 885506], length 0
2019-05-03 21:07:39.029250 IP 172.16.47.1.63210 > 172.16.47.168.ssh: Flags [.], ack 577, win 2046, options [nop,nop,TS val 238828997 ecr 885506], length 0
2019-05-03 21:07:39.029251 IP 172.16.47.168.ssh > 172.16.47.1.63210: Flags [P.], seq 577:649, ack 36, win 1452, options [nop,nop,TS val 885506 ecr 238828997], length 72
2019-05-03 21:07:39.029256 IP 172.16.47.168.ssh > 172.16.47.1.63210: Flags [P.], seq 577:649, ack 36, win 1452, options [nop,nop,TS val 885506 ecr 238828997], length 72
2019-05-03 21:07:39.029390 IP 172.16.47.1.63210 > 172.16.47.168.ssh: Flags [.], ack 649, win 2046, options [nop,nop,TS val 238828998 ecr 885506], length 0
2019-05-03 21:07:39.029394 IP 172.16.47.1.63210 > 172.16.47.168.ssh: Flags [.], ack 649, win 2046, options [nop,nop,TS val 238828998 ecr 885506], length 0
2019-05-03 21:07:39.029412 IP 172.16.47.168.ssh > 172.16.47.1.63210: Flags [P.], seq 649:685, ack 36, win 1452, options [nop,nop,TS val 885506 ecr 238828998], length 36
2019-05-03 21:07:39.029418 IP 172.16.47.168.ssh > 172.16.47.1.63210: Flags [P.], seq 649:685, ack 36, win 1452, options [nop,nop,TS val 885506 ecr 238828998], length 36
2019-05-03 21:07:39.029550 IP 172.16.47.1.63210 > 172.16.47.168.ssh: Flags [.], ack 685, win 2047, options [nop,nop,TS val 238828998 ecr 885506], length 0
2019-05-03 21:07:39.029555 IP 172.16.47.1.63210 > 172.16.47.168.ssh: Flags [.], ack 685, win 2047, options [nop,nop,TS val 238828998 ecr 885506], length 0
2019-05-03 21:07:39.029566 IP 172.16.47.168.ssh > 172.16.47.1.63210: Flags [P.], seq 685:721, ack 36, win 1452, options [nop,nop,TS val 885506 ecr 238828998], length 36
2019-05-03 21:07:39.029569 IP 172.16.47.168.ssh > 172.16.47.1.63210: Flags [P.], seq 685:721, ack 36, win 1452, options [nop,nop,TS val 885506 ecr 238828998], length 36
2019-05-03 21:07:39.029672 IP 172.16.47.1.63210 > 172.16.47.168.ssh: Flags [.], ack 721, win 2047, options [nop,nop,TS val 238828998 ecr 885506], length 0
2019-05-03 21:07:39.029676 IP 172.16.47.1.63210 > 172.16.47.168.ssh: Flags [.], ack 721, win 2047, options [nop,nop,TS val 238828998 ecr 885506], length 0
2019-05-03 21:07:39.029683 IP 172.16.47.168.ssh > 172.16.47.1.63210: Flags [P.], seq 721:757, ack 36, win 1452, options [nop,nop,TS val 885506 ecr 238828998], length 36
2019-05-03 21:07:39.029686 IP 172.16.47.168.ssh > 172.16.47.1.63210: Flags [P.], seq 721:757, ack 36, win 1452, options [nop,nop,TS val 885506 ecr 238828998], length 36
2019-05-03 21:07:39.029809 IP 172.16.47.1.63210 > 172.16.47.168.ssh: Flags [.], ack 757, win 2047, options [nop,nop,TS val 238828998 ecr 885506], length 0
2019-05-03 21:07:39.029814 IP 172.16.47.1.63210 > 172.16.47.168.ssh: Flags [.], ack 757, win 2047, options [nop,nop,TS val 238828998 ecr 885506], length 0
2019-05-03 21:07:39.029827 IP 172.16.47.168.ssh > 172.16.47.1.63210: Flags [P.], seq 757:793, ack 36, win 1452, options [nop,nop,TS val 885506 ecr 238828998], length 36
2019-05-03 21:07:39.029832 IP 172.16.47.168.ssh > 172.16.47.1.63210: Flags [P.], seq 757:793, ack 36, win 1452, options [nop,nop,TS val 885506 ecr 238828998], length 36
2019-05-03 21:07:39.029947 IP 172.16.47.1.63210 > 172.16.47.168.ssh: Flags [.], ack 793, win 2047, options [nop,nop,TS val 238828998 ecr 885506], length 0
2019-05-03 21:07:39.029952 IP 172.16.47.1.63210 > 172.16.47.168.ssh: Flags [.], ack 793, win 2047, options [nop,nop,TS val 238828998 ecr 885506], length 0
2019-05-03 21:07:39.029962 IP 172.16.47.168.ssh > 172.16.47.1.63210: Flags [P.], seq 793:829, ack 36, win 1452, options [nop,nop,TS val 885506 ecr 238828998], length 36
2019-05-03 21:07:39.029965 IP 172.16.47.168.ssh > 172.16.47.1.63210: Flags [P.], seq 793:829, ack 36, win 1452, options [nop,nop,TS val 885506 ecr 238828998], length 36
2019-05-03 21:07:39.030065 IP 172.16.47.1.63210 > 172.16.47.168.ssh: Flags [.], ack 829, win 2047, options [nop,nop,TS val 238828998 ecr 885506], length 0
2019-05-03 21:07:39.030069 IP 172.16.47.1.63210 > 172.16.47.168.ssh: Flags [.], ack 829, win 2047, options [nop,nop,TS val 238828998 ecr 885506], length 0
2019-05-03 21:07:39.030076 IP 172.16.47.168.ssh > 172.16.47.1.63210: Flags [P.], seq 829:865, ack 36, win 1452, options [nop,nop,TS val 885506 ecr 238828998], length 36
2019-05-03 21:07:39.030078 IP 172.16.47.168.ssh > 172.16.47.1.63210: Flags [P.], seq 829:865, ack 36, win 1452, options [nop,nop,TS val 885506 ecr 238828998], length 36
2019-05-03 21:07:39.030192 IP 172.16.47.1.63210 > 172.16.47.168.ssh: Flags [.], ack 865, win 2047, options [nop,nop,TS val 238828998 ecr 885506], length 0
2019-05-03 21:07:39.030197 IP 172.16.47.1.63210 > 172.16.47.168.ssh: Flags [.], ack 865, win 2047, options [nop,nop,TS val 238828998 ecr 885506], length 0
2019-05-03 21:07:39.030207 IP 172.16.47.168.ssh > 172.16.47.1.63210: Flags [P.], seq 865:901, ack 36, win 1452, options [nop,nop,TS val 885506 ecr 238828998], length 36
2019-05-03 21:07:39.030212 IP 172.16.47.168.ssh > 172.16.47.1.63210: Flags [P.], seq 865:901, ack 36, win 1452, options [nop,nop,TS val 885506 ecr 238828998], length 36
2019-05-03 21:07:39.030321 IP 172.16.47.1.63210 > 172.16.47.168.ssh: Flags [.], ack 901, win 2047, options [nop,nop,TS val 238828998 ecr 885506], length 0
2019-05-03 21:07:39.030325 IP 172.16.47.1.63210 > 172.16.47.168.ssh: Flags [.], ack 901, win 2047, options [nop,nop,TS val 238828998 ecr 885506], length 0
2019-05-03 21:07:39.030332 IP 172.16.47.168.ssh > 172.16.47.1.63210: Flags [P.], seq 901:937, ack 36, win 1452, options [nop,nop,TS val 885506 ecr 238828998], length 36
2019-05-03 21:07:39.030335 IP 172.16.47.168.ssh > 172.16.47.1.63210: Flags [P.], seq 901:937, ack 36, win 1452, options [nop,nop,TS val 885506 ecr 238828998], length 36
2019-05-03 21:07:39.030441 IP 172.16.47.1.63210 > 172.16.47.168.ssh: Flags [.], ack 937, win 2047, options [nop,nop,TS val 238828999 ecr 885506], length 0
2019-05-03 21:07:39.030444 IP 172.16.47.1.63210 > 172.16.47.168.ssh: Flags [.], ack 937, win 2047, options [nop,nop,TS val 238828999 ecr 885506], length 0
2019-05-03 21:07:39.030452 IP 172.16.47.168.ssh > 172.16.47.1.63210: Flags [P.], seq 937:973, ack 36, win 1452, options [nop,nop,TS val 885506 ecr 238828999], length 36
2019-05-03 21:07:39.030457 IP 172.16.47.168.ssh > 172.16.47.1.63210: Flags [P.], seq 937:973, ack 36, win 1452, options [nop,nop,TS val 885506 ecr 238828999], length 36
2019-05-03 21:07:39.030571 IP 172.16.47.1.63210 > 172.16.47.168.ssh: Flags [.], ack 973, win 2047, options [nop,nop,TS val 238828999 ecr 885506], length 0
2019-05-03 21:07:39.030576 IP 172.16.47.1.63210 > 172.16.47.168.ssh: Flags [.], ack 973, win 2047, options [nop,nop,TS val 238828999 ecr 885506], length 0
2019-05-03 21:07:39.030586 IP 172.16.47.168.ssh > 172.16.47.1.63210: Flags [P.], seq 973:1009, ack 36, win 1452, options [nop,nop,TS val 885506 ecr 238828999], length 36
2019-05-03 21:07:39.030589 IP 172.16.47.168.ssh > 172.16.47.1.63210: Flags [P.], seq 973:1009, ack 36, win 1452, options [nop,nop,TS val 885506 ecr 238828999], length 36
