reading from file tcpdump-lampson2.pcap, link-type EN10MB (Ethernet)
2019-05-04 18:27:13.563931 IP 172.16.47.170.39078 > 172.16.47.2.domain: 42778+ A? www.cs.columbia.edu. (37)
2019-05-04 18:27:13.564066 IP 172.16.47.170.39078 > 172.16.47.2.domain: 57390+ AAAA? www.cs.columbia.edu. (37)
2019-05-04 18:27:13.569026 IP 172.16.47.2.domain > 172.16.47.170.39078: 57390 1/1/0 CNAME webcluster.cs.columbia.edu. (116)
2019-05-04 18:27:13.569039 IP 172.16.47.2.domain > 172.16.47.170.39078: 42778 2/0/0 CNAME webcluster.cs.columbia.edu., A 128.59.11.206 (78)
2019-05-04 18:27:13.575490 IP 172.16.47.170.44786 > 128.59.11.206.http: Flags [S], seq 3549297218, win 29200, options [mss 1460,sackOK,TS val 3699158 ecr 0,nop,wscale 7], length 0
2019-05-04 18:27:13.578467 IP 128.59.11.206.http > 172.16.47.170.44786: Flags [S.], seq 1032370247, ack 3549297219, win 64240, options [mss 1460], length 0
2019-05-04 18:27:13.578483 IP 172.16.47.170.44786 > 128.59.11.206.http: Flags [.], ack 1, win 29200, length 0
2019-05-04 18:27:13.578655 IP 172.16.47.170.44786 > 128.59.11.206.http: Flags [P.], seq 1:141, ack 1, win 29200, length 140: HTTP: GET /~nieh/teaching/e6118/papers/1_22_lampson_hints-design.pdf HTTP/1.1
2019-05-04 18:27:13.578868 IP 128.59.11.206.http > 172.16.47.170.44786: Flags [.], ack 141, win 64240, length 0
2019-05-04 18:27:13.624088 IP 128.59.11.206.http > 172.16.47.170.44786: Flags [P.], seq 1:5497, ack 141, win 64240, length 5496: HTTP: HTTP/1.1 200 OK
2019-05-04 18:27:13.624106 IP 172.16.47.170.44786 > 128.59.11.206.http: Flags [.], ack 5497, win 39420, length 0
2019-05-04 18:27:13.626806 IP 128.59.11.206.http > 172.16.47.170.44786: Flags [P.], seq 5497:15115, ack 141, win 64240, length 9618: HTTP
2019-05-04 18:27:13.626847 IP 172.16.47.170.44786 > 128.59.11.206.http: Flags [.], ack 15115, win 58400, length 0
2019-05-04 18:27:13.626852 IP 128.59.11.206.http > 172.16.47.170.44786: Flags [P.], seq 15115:17863, ack 141, win 64240, length 2748: HTTP
2019-05-04 18:27:13.626855 IP 172.16.47.170.44786 > 128.59.11.206.http: Flags [.], ack 17863, win 64240, length 0
2019-05-04 18:27:13.627189 IP 128.59.11.206.http > 172.16.47.170.44786: Flags [P.], seq 17863:19237, ack 141, win 64240, length 1374: HTTP
2019-05-04 18:27:13.627201 IP 172.16.47.170.44786 > 128.59.11.206.http: Flags [.], ack 19237, win 64240, length 0
2019-05-04 18:27:13.628450 IP 128.59.11.206.http > 172.16.47.170.44786: Flags [P.], seq 19237:26107, ack 141, win 64240, length 6870: HTTP
2019-05-04 18:27:13.628465 IP 172.16.47.170.44786 > 128.59.11.206.http: Flags [.], ack 26107, win 64240, length 0
2019-05-04 18:27:13.629393 IP 128.59.11.206.http > 172.16.47.170.44786: Flags [P.], seq 26107:32977, ack 141, win 64240, length 6870: HTTP
2019-05-04 18:27:13.629409 IP 172.16.47.170.44786 > 128.59.11.206.http: Flags [.], ack 32977, win 64240, length 0
2019-05-04 18:27:13.629414 IP 128.59.11.206.http > 172.16.47.170.44786: Flags [P.], seq 32977:34351, ack 141, win 64240, length 1374: HTTP
2019-05-04 18:27:13.629417 IP 172.16.47.170.44786 > 128.59.11.206.http: Flags [.], ack 34351, win 64240, length 0
2019-05-04 18:27:13.633322 IP 128.59.11.206.http > 172.16.47.170.44786: Flags [P.], seq 34351:49465, ack 141, win 64240, length 15114: HTTP
2019-05-04 18:27:13.633339 IP 172.16.47.170.44786 > 128.59.11.206.http: Flags [.], ack 49465, win 64240, length 0

